{
  "$schema": "https://json-schema.org/draft/2020-12/schema",
  "$id": "https://rua.serverless-under-constraints.invalid/schemas/transport_scope_snapshot.schema.json",
  "title": "transport_scope_snapshot (BR-RUA-028)",
  "description": "The frozen qualification scope: the policy digest, the resolved entry points, every resolved source file with its exact digest, the transitive production dependency closure with resolved versions, the digest of the closure's lockfile entries, the normalized configuration projections (provider and controller; each selected resource as a list of policy property paths with the canonical JSON text of their values), the runtime property values (scalars named by the committed policy, which owns their meaning; the snapshot builder checks each one against it), the timing values and the provider warm-up policy (addendum §2). Source files are listed once per path in strictly ascending code-point order; that per-path uniqueness and order are checked in code by the snapshot builder (it derives the list from a set of paths), not by this schema, which rejects only byte-identical duplicate entries. The snapshot carries no execution identity and no timestamp, so a recomputation over unchanged committed source is byte-identical and drift is a structural difference.",
  "type": "object",
  "properties": {
    "schema_version": { "const": 1 },
    "record_type": { "const": "transport_scope_snapshot" },
    "policy_sha256": { "$ref": "_defs.schema.json#/$defs/sha256" },
    "entry_points": {
      "type": "array",
      "items": { "$ref": "_defs.schema.json#/$defs/package_relative_path" },
      "minItems": 1,
      "uniqueItems": true
    },
    "source_files": {
      "type": "array",
      "items": {
        "type": "object",
        "properties": {
          "path": { "$ref": "_defs.schema.json#/$defs/package_relative_path" },
          "sha256": { "$ref": "_defs.schema.json#/$defs/sha256" }
        },
        "required": ["path", "sha256"],
        "additionalProperties": false
      },
      "minItems": 1,
      "uniqueItems": true
    },
    "dependency_closure": {
      "type": "array",
      "items": {
        "type": "object",
        "properties": {
          "name": { "type": "string", "pattern": "^(@[a-z0-9][a-z0-9._~-]*/)?[a-z0-9][a-z0-9._~-]*$" },
          "version": { "$ref": "_defs.schema.json#/$defs/nonempty_trimmed" }
        },
        "required": ["name", "version"],
        "additionalProperties": false
      },
      "minItems": 1,
      "uniqueItems": true
    },
    "lockfile_sha256": {
      "description": "SHA-256 (lowercase hex) of the UTF-8 bytes of the canonical JSON text (BR-RUA-034 canonical form) of one object: one member per package of the transitive production dependency closure, named by its package-lock.json install path (for example node_modules/@scope/name or node_modules/a/node_modules/b) and holding that lockfile entry's version, plus its resolved and integrity values when the entry records them (omitted otherwise). It is not a digest of the package-lock.json bytes: lockfileVersion and the entries of packages outside the closure are not digested, so a dependency change outside the closure is no drift, while a re-published tarball under the same version is.",
      "$ref": "_defs.schema.json#/$defs/sha256"
    },
    "configuration_projections": {
      "type": "array",
      "items": {
        "type": "object",
        "properties": {
          "projection_id": { "type": "string", "pattern": "^[a-z][a-z0-9_]*$" },
          "resources": {
            "description": "One entry per selected template resource, in canonical order. Two resources with the same configuration give two equal entries, so the list is not unique.",
            "type": "array",
            "items": {
              "type": "object",
              "properties": {
                "property_values": {
                  "type": "array",
                  "items": { "$ref": "#/$defs/projected_property" },
                  "minItems": 1,
                  "uniqueItems": true
                }
              },
              "required": ["property_values"],
              "additionalProperties": false
            },
            "minItems": 1
          }
        },
        "required": ["projection_id", "resources"],
        "additionalProperties": false
      },
      "minItems": 1,
      "uniqueItems": true
    },
    "runtime_properties": {
      "type": "object",
      "propertyNames": { "pattern": "^[a-z][a-z0-9_]*$" },
      "additionalProperties": {
        "anyOf": [
          { "type": "string" },
          { "type": "integer", "minimum": -9007199254740991, "maximum": 9007199254740991 },
          { "type": "boolean" }
        ]
      }
    },
    "timing_values": {
      "type": "object",
      "properties": {
        "provider_client_deadline_ms": { "type": "integer", "minimum": 1, "maximum": 9007199254740991 },
        "provider_safety_release_ms": { "type": "integer", "minimum": 1, "maximum": 9007199254740991 },
        "provider_execution_timeout_ms": { "type": "integer", "minimum": 1, "maximum": 9007199254740991 },
        "treatment_poll_interval_ms": { "type": "integer", "minimum": 1, "maximum": 9007199254740991 }
      },
      "required": [
        "provider_client_deadline_ms",
        "provider_safety_release_ms",
        "provider_execution_timeout_ms",
        "treatment_poll_interval_ms"
      ],
      "additionalProperties": false
    },
    "provider_warmup": {
      "type": "object",
      "properties": { "invocations_per_trial": { "const": 1 } },
      "required": ["invocations_per_trial"],
      "additionalProperties": false
    }
  },
  "required": [
    "schema_version",
    "record_type",
    "policy_sha256",
    "entry_points",
    "source_files",
    "dependency_closure",
    "lockfile_sha256",
    "configuration_projections",
    "runtime_properties",
    "timing_values",
    "provider_warmup"
  ],
  "additionalProperties": false,
  "$defs": {
    "projected_property": {
      "description": "One policy property path of one resource. canonical_json is the canonical JSON text (BR-RUA-034 canonical form) of the normalized CloudFormation value, kept as text because CloudFormation member names (PascalCase, Fn::GetAtt) are not BR-RUA-033 property names. It is omitted when the resource does not set the property: absence is configuration too, so setting it later is drift. The schema checks only that the text is non-empty: that it parses and equals canonicalJson of its parse, and that each policy path appears once per resource, are code-level checks of the snapshot builder (WP-11 normalizeConfigurationProjection, which writes canonicalJson output for each path of a policy whose property_paths are unique).",
      "type": "object",
      "properties": {
        "property_path": { "type": "string", "pattern": "^[A-Za-z0-9]+(\\.[A-Za-z0-9]+)*$" },
        "canonical_json": { "type": "string", "minLength": 1 }
      },
      "required": ["property_path"],
      "additionalProperties": false
    }
  }
}
