{"configuration_projections":[{"projection_id":"experiment_core__functions","resources":[{"property_values":[{"canonical_json":"[\"x86_64\"]","property_path":"Properties.Architectures"},{"canonical_json":"\"index.handler\"","property_path":"Properties.Handler"},{"canonical_json":"512","property_path":"Properties.MemorySize"},{"property_path":"Properties.ReservedConcurrentExecutions"},{"canonical_json":"{\"Fn::GetAtt\":[\"<ExperimentCore/Controller/Role/Resource>\",\"Arn\"]}","property_path":"Properties.Role"},{"canonical_json":"\"nodejs24.x\"","property_path":"Properties.Runtime"},{"canonical_json":"30","property_path":"Properties.Timeout"}]},{"property_values":[{"canonical_json":"[\"x86_64\"]","property_path":"Properties.Architectures"},{"canonical_json":"\"index.handler\"","property_path":"Properties.Handler"},{"canonical_json":"512","property_path":"Properties.MemorySize"},{"property_path":"Properties.ReservedConcurrentExecutions"},{"canonical_json":"{\"Fn::GetAtt\":[\"<ExperimentCore/Provider/Role/Resource>\",\"Arn\"]}","property_path":"Properties.Role"},{"canonical_json":"\"nodejs24.x\"","property_path":"Properties.Runtime"},{"canonical_json":"30","property_path":"Properties.Timeout"}]}]},{"projection_id":"experiment_core__policies","resources":[{"property_values":[{"canonical_json":"{\"Statement\":[{\"Action\":[\"logs:CreateLogStream\",\"logs:PutLogEvents\"],\"Effect\":\"Allow\",\"Resource\":{\"Fn::GetAtt\":[\"<ExperimentCore/Controller/LogGroup/Resource>\",\"Arn\"]}},{\"Action\":\"dynamodb:PutItem\",\"Effect\":\"Allow\",\"Resource\":{\"Fn::GetAtt\":[\"<ExperimentCore/ExperimentJournalTable/Resource>\",\"Arn\"]}},{\"Action\":[\"dynamodb:GetItem\",\"dynamodb:UpdateItem\"],\"Effect\":\"Allow\",\"Resource\":{\"Fn::GetAtt\":[\"<ExperimentCore/ControlTable/Resource>\",\"Arn\"]}},{\"Action\":\"dynamodb:ListStreams\",\"Effect\":\"Allow\",\"Resource\":\"*\"},{\"Action\":[\"dynamodb:DescribeStream\",\"dynamodb:GetRecords\",\"dynamodb:GetShardIterator\"],\"Effect\":\"Allow\",\"Resource\":{\"Fn::GetAtt\":[\"<ExperimentCore/CallerJournalTable/Resource>\",\"StreamArn\"]}},{\"Action\":[\"sqs:SendMessage\",\"sqs:GetQueueAttributes\",\"sqs:GetQueueUrl\"],\"Effect\":\"Allow\",\"Resource\":{\"Fn::GetAtt\":[\"<ExperimentCore/ControllerFailure/Resource>\",\"Arn\"]}}],\"Version\":\"2012-10-17\"}","property_path":"Properties.PolicyDocument"},{"canonical_json":"[{\"Ref\":\"<ExperimentCore/Controller/Role/Resource>\"}]","property_path":"Properties.Roles"}]},{"property_values":[{"canonical_json":"{\"Statement\":[{\"Action\":[\"logs:CreateLogStream\",\"logs:PutLogEvents\"],\"Effect\":\"Allow\",\"Resource\":{\"Fn::GetAtt\":[\"<ExperimentCore/Provider/LogGroup/Resource>\",\"Arn\"]}},{\"Action\":\"dynamodb:PutItem\",\"Effect\":\"Allow\",\"Resource\":{\"Fn::GetAtt\":[\"<ExperimentCore/LedgerTable/Resource>\",\"Arn\"]}},{\"Action\":\"dynamodb:PutItem\",\"Effect\":\"Allow\",\"Resource\":{\"Fn::GetAtt\":[\"<ExperimentCore/ExperimentJournalTable/Resource>\",\"Arn\"]}},{\"Action\":[\"dynamodb:GetItem\",\"dynamodb:UpdateItem\",\"dynamodb:ConditionCheckItem\"],\"Effect\":\"Allow\",\"Resource\":{\"Fn::GetAtt\":[\"<ExperimentCore/ControlTable/Resource>\",\"Arn\"]}}],\"Version\":\"2012-10-17\"}","property_path":"Properties.PolicyDocument"},{"canonical_json":"[{\"Ref\":\"<ExperimentCore/Provider/Role/Resource>\"}]","property_path":"Properties.Roles"}]}]},{"projection_id":"experiment_core__stream_mappings","resources":[{"property_values":[{"canonical_json":"1","property_path":"Properties.BatchSize"},{"canonical_json":"false","property_path":"Properties.BisectBatchOnFunctionError"},{"canonical_json":"{\"OnFailure\":{\"Destination\":{\"Fn::GetAtt\":[\"<ExperimentCore/ControllerFailure/Resource>\",\"Arn\"]}}}","property_path":"Properties.DestinationConfig"},{"canonical_json":"{\"Fn::GetAtt\":[\"<ExperimentCore/CallerJournalTable/Resource>\",\"StreamArn\"]}","property_path":"Properties.EventSourceArn"},{"canonical_json":"{\"Filters\":[{\"Pattern\":\"{\\\"eventName\\\":[\\\"INSERT\\\"],\\\"dynamodb\\\":{\\\"NewImage\\\":{\\\"record_type\\\":{\\\"S\\\":[\\\"caller_timeout_recorded\\\"]}}}}\"}]}","property_path":"Properties.FilterCriteria"},{"canonical_json":"{\"Ref\":\"<ExperimentCore/Controller/Function/Resource>\"}","property_path":"Properties.FunctionName"},{"property_path":"Properties.FunctionResponseTypes"},{"canonical_json":"0","property_path":"Properties.MaximumBatchingWindowInSeconds"},{"canonical_json":"3600","property_path":"Properties.MaximumRecordAgeInSeconds"},{"canonical_json":"2","property_path":"Properties.MaximumRetryAttempts"},{"canonical_json":"1","property_path":"Properties.ParallelizationFactor"},{"canonical_json":"\"TRIM_HORIZON\"","property_path":"Properties.StartingPosition"}]}]},{"projection_id":"experiment_core__tables","resources":[{"property_values":[{"canonical_json":"[{\"AttributeName\":\"pk\",\"AttributeType\":\"S\"},{\"AttributeName\":\"sk\",\"AttributeType\":\"S\"}]","property_path":"Properties.AttributeDefinitions"},{"canonical_json":"\"PAY_PER_REQUEST\"","property_path":"Properties.BillingMode"},{"canonical_json":"[{\"AttributeName\":\"pk\",\"KeyType\":\"HASH\"},{\"AttributeName\":\"sk\",\"KeyType\":\"RANGE\"}]","property_path":"Properties.KeySchema"},{"canonical_json":"{\"StreamViewType\":\"NEW_IMAGE\"}","property_path":"Properties.StreamSpecification"},{"canonical_json":"\"suc1-<p>-caller-journal\"","property_path":"Properties.TableName"},{"property_path":"Properties.TimeToLiveSpecification"}]},{"property_values":[{"canonical_json":"[{\"AttributeName\":\"pk\",\"AttributeType\":\"S\"},{\"AttributeName\":\"sk\",\"AttributeType\":\"S\"}]","property_path":"Properties.AttributeDefinitions"},{"canonical_json":"\"PAY_PER_REQUEST\"","property_path":"Properties.BillingMode"},{"canonical_json":"[{\"AttributeName\":\"pk\",\"KeyType\":\"HASH\"},{\"AttributeName\":\"sk\",\"KeyType\":\"RANGE\"}]","property_path":"Properties.KeySchema"},{"property_path":"Properties.StreamSpecification"},{"canonical_json":"\"suc1-<p>-control\"","property_path":"Properties.TableName"},{"property_path":"Properties.TimeToLiveSpecification"}]},{"property_values":[{"canonical_json":"[{\"AttributeName\":\"pk\",\"AttributeType\":\"S\"},{\"AttributeName\":\"sk\",\"AttributeType\":\"S\"}]","property_path":"Properties.AttributeDefinitions"},{"canonical_json":"\"PAY_PER_REQUEST\"","property_path":"Properties.BillingMode"},{"canonical_json":"[{\"AttributeName\":\"pk\",\"KeyType\":\"HASH\"},{\"AttributeName\":\"sk\",\"KeyType\":\"RANGE\"}]","property_path":"Properties.KeySchema"},{"property_path":"Properties.StreamSpecification"},{"canonical_json":"\"suc1-<p>-experiment-journal\"","property_path":"Properties.TableName"},{"property_path":"Properties.TimeToLiveSpecification"}]},{"property_values":[{"canonical_json":"[{\"AttributeName\":\"pk\",\"AttributeType\":\"S\"},{\"AttributeName\":\"sk\",\"AttributeType\":\"S\"}]","property_path":"Properties.AttributeDefinitions"},{"canonical_json":"\"PAY_PER_REQUEST\"","property_path":"Properties.BillingMode"},{"canonical_json":"[{\"AttributeName\":\"pk\",\"KeyType\":\"HASH\"},{\"AttributeName\":\"sk\",\"KeyType\":\"RANGE\"}]","property_path":"Properties.KeySchema"},{"property_path":"Properties.StreamSpecification"},{"canonical_json":"\"suc1-<p>-ledger\"","property_path":"Properties.TableName"},{"property_path":"Properties.TimeToLiveSpecification"}]},{"property_values":[{"canonical_json":"[{\"AttributeName\":\"pk\",\"AttributeType\":\"S\"},{\"AttributeName\":\"sk\",\"AttributeType\":\"S\"}]","property_path":"Properties.AttributeDefinitions"},{"canonical_json":"\"PAY_PER_REQUEST\"","property_path":"Properties.BillingMode"},{"canonical_json":"[{\"AttributeName\":\"pk\",\"KeyType\":\"HASH\"},{\"AttributeName\":\"sk\",\"KeyType\":\"RANGE\"}]","property_path":"Properties.KeySchema"},{"property_path":"Properties.StreamSpecification"},{"canonical_json":"\"suc1-<p>-trial-registry\"","property_path":"Properties.TableName"},{"property_path":"Properties.TimeToLiveSpecification"}]}]},{"projection_id":"experiment_core__versions","resources":[{"property_values":[{"canonical_json":"{\"Ref\":\"<ExperimentCore/Provider/Function/Resource>\"}","property_path":"Properties.FunctionName"},{"property_path":"Properties.ProvisionedConcurrencyConfig"}]}]}],"dependency_closure":[{"name":"@aws-sdk/client-dynamodb","version":"3.1146.0"},{"name":"@aws-sdk/client-lambda","version":"3.1146.0"},{"name":"@aws-sdk/core","version":"3.978.1"},{"name":"@aws-sdk/credential-provider-env","version":"3.972.72"},{"name":"@aws-sdk/credential-provider-http","version":"3.972.74"},{"name":"@aws-sdk/credential-provider-ini","version":"3.973.17"},{"name":"@aws-sdk/credential-provider-login","version":"3.972.79"},{"name":"@aws-sdk/credential-provider-node","version":"3.972.84"},{"name":"@aws-sdk/credential-provider-process","version":"3.972.72"},{"name":"@aws-sdk/credential-provider-sso","version":"3.973.16"},{"name":"@aws-sdk/credential-provider-web-identity","version":"3.972.78"},{"name":"@aws-sdk/dynamodb-codec","version":"3.973.46"},{"name":"@aws-sdk/endpoint-cache","version":"3.972.11"},{"name":"@aws-sdk/middleware-endpoint-discovery","version":"3.972.31"},{"name":"@aws-sdk/nested-clients","version":"3.997.46"},{"name":"@aws-sdk/signature-v4-multi-region","version":"3.996.47"},{"name":"@aws-sdk/token-providers","version":"3.1138.0"},{"name":"@aws-sdk/xml-builder","version":"3.972.41"},{"name":"@aws/lambda-invoke-store","version":"0.3.0"},{"name":"@smithy/core","version":"3.35.1"},{"name":"@smithy/credential-provider-imds","version":"4.5.2"},{"name":"@smithy/node-http-handler","version":"4.12.1"},{"name":"@smithy/signature-v4","version":"5.7.4"},{"name":"@smithy/types","version":"4.19.0"},{"name":"aws-cdk-lib","version":"2.272.0"},{"name":"bowser","version":"2.14.1"},{"name":"esbuild","version":"0.28.2"},{"name":"mnemonist","version":"0.38.3"},{"name":"obliterator","version":"1.6.1"}],"entry_points":["src/refund-provider/refund-provider.handler.ts","src/transport-pro